{
  "approvalId": "approval-20260704-ag-digitalz-netlify-staging-redeploy",
  "status": "expired",
  "ownerId": "owner-gurnoor-bassi",
  "requestedBy": "ag-os-runtime",
  "approvedBy": "owner-gurnoor-bassi",
  "projectId": "project-social-media-management-system-v1",
  "commandCategory": "deploy_staging",
  "requestedAction": "Redeploy the dedicated Netlify staging-only site for gurnoorbassi/ag-social-media-management-system from main after the AG Digitalz draft config merge.",
  "target": "netlify:ag-social-media-management-system-staging",
  "scope": "This approval allows AG OS to use Netlify for exactly one staging-only redeploy of the existing dedicated Netlify site ag-social-media-management-system-staging from gurnoorbassi/ag-social-media-management-system main at commit 6f54d3b5b257c2662319f39c0b89f810e22289e5. The allowed live actions are limited to redeploying that staging-only site, verifying the staging URL returns HTTP 200, recording the Netlify deployment result, and stopping before production, custom domain, DNS, paid features, sensitive values, social account connection, social credentials, posting, scheduling, n8n activation, private client data, Lead Gen, AI Receptionist, or Constitution changes.",
  "riskLevel": "R4",
  "dataClass": "internal",
  "budget": {
    "required": false,
    "maxUsd": 0,
    "usageLedgerRef": ".codex/costs/cost-ledger-20260704-ag-digitalz-netlify-staging-redeploy.json"
  },
  "approvalRequiredFor": [
    "deploy_staging"
  ],
  "approvedActions": [
    "redeploy_netlify_staging"
  ],
  "prohibitedActions": [
    "deploy_production",
    "create_production_deploy",
    "change_domain",
    "change_dns",
    "add_custom_domain",
    "connect_n8n",
    "activate_n8n",
    "connect_social_accounts",
    "use_social_credentials",
    "post_content",
    "schedule_content",
    "use_analytics_api",
    "use_paid_service",
    "use_credentials",
    "add_sensitive_values",
    "add_tracking_scripts",
    "wire_forms_to_live_services",
    "access_private_client_data",
    "access_production_data",
    "access_customer_data",
    "change_lead_gen",
    "change_ai_receptionist",
    "change_constitution"
  ],
  "revocationPath": "Expired approval lock blocked or would block the mandatory boot sequence. Original expiration: 2026-07-06T02:10:39Z. This approval is no longer valid for gated actions. Historical proof remains preserved; any future action requires a new scoped owner approval lock.",
  "evidence": [
    {
      "type": "owner_instruction",
      "reference": "Owner-approved orchestrated task granted scoped approval to redeploy the Social Media staging site after AG Digitalz config merge.",
      "verified": true
    },
    {
      "type": "pr_link",
      "reference": "https://github.com/gurnoorbassi/ag-os/pull/106",
      "verified": true
    },
    {
      "type": "pr_link",
      "reference": "https://github.com/gurnoorbassi/ag-social-media-management-system/pull/3",
      "verified": true
    },
    {
      "type": "other",
      "reference": ".codex/netlify/netlify-plan-20260704-social-media-staging.json",
      "verified": true
    },
    {
      "type": "validation_output",
      "reference": "npm.cmd run dashboard:check, npm.cmd run validate, npm.cmd run boot:check, and node --test tests/*.test.mjs passed before execution.",
      "verified": true
    }
  ],
  "approvalText": "Owner-approved orchestrated task: redeploy the dedicated Netlify staging-only site ag-social-media-management-system-staging after the AG Digitalz config target PR is merged. Allowed live action: redeploy staging from gurnoorbassi/ag-social-media-management-system main at 6f54d3b5b257c2662319f39c0b89f810e22289e5 and verify HTTP 200. Do not create production deployment, change DNS, add custom domain, use paid features, store sensitive values, connect social accounts, post, schedule, use analytics API, activate n8n, use private client data, touch Lead Gen, touch AI Receptionist, or change Constitution.",
  "approvedAt": "2026-07-05T02:10:39Z",
  "expiresAt": "2026-07-06T02:10:39Z",
  "createdAt": "2026-07-05T02:10:39Z",
  "updatedAt": "2026-07-06T20:28:06.762Z"
}
