{
  "approvalId": "approval-20260705-social-media-interactive-draft-ui",
  "status": "approved",
  "ownerId": "owner-gurnoor-bassi",
  "requestedBy": "ag-os-runtime",
  "approvedBy": "owner-gurnoor-bassi",
  "projectId": "project-social-media-management-system-v1",
  "commandCategory": "build",
  "requestedAction": "Make the Social Media Management System staging app clickable and usable in draft mode, merge the reviewed target PR if clean, redeploy the dedicated Netlify staging-only site, and record proof.",
  "target": "github:gurnoorbassi/ag-social-media-management-system; netlify:ag-social-media-management-system-staging; ag-os:proof-records",
  "scope": "This approval allows exactly one target repo branch ag-os/social-media-interactive-draft-ui-v1, static frontend app updates for draft-mode navigation, post package expansion, calendar filtering, approval queue local UI state, weekly report copy/download, blocked-action explanations, one target PR, merge if clean, one redeploy of the existing dedicated staging-only Netlify site, and AG OS proof records. It does not authorize OAuth, social account connection, credentials, posting, scheduling, analytics API use, DMs/comments, n8n activation, paid tools, domain/DNS, custom domain, production deploy, real client private data, Lead Gen changes, AI Receptionist changes, Constitution changes, accepted lessons, or permanent memory.",
  "riskLevel": "R4",
  "dataClass": "internal",
  "budget": {
    "required": false,
    "maxUsd": 0,
    "usageLedgerRef": ".codex/costs/cost-ledger-20260705-social-media-interactive-draft-ui.json"
  },
  "approvalRequiredFor": [
    "update_target_app",
    "merge_pr",
    "deploy_staging",
    "record_proof"
  ],
  "approvedActions": [
    "create_branch",
    "update_files",
    "open_pr",
    "review_pr",
    "merge_pr",
    "redeploy_netlify_staging",
    "record_proof"
  ],
  "prohibitedActions": [
    "start_oauth",
    "connect_social_accounts",
    "store_credentials",
    "post_content",
    "schedule_content",
    "use_analytics_api",
    "send_dm",
    "send_comment",
    "activate_n8n",
    "deploy_production",
    "change_domain",
    "change_dns",
    "add_custom_domain",
    "use_paid_service",
    "access_private_client_data",
    "access_customer_data",
    "access_production_data",
    "change_lead_gen",
    "change_ai_receptionist",
    "change_constitution",
    "create_accepted_lesson",
    "create_permanent_memory"
  ],
  "revocationPath": "This approval is revoked, expired, cancelled, or invalidated when the owner says stop or revoke, the expiration passes, the target repo changes outside PR #7, PR #7 head SHA changes from 87f5d13dc47daaa1eca42e13326a55c2b38813d1 before merge, target repo main SHA changes from daeb7c4f6e0aaaced7b55eb8fa50978320eff15e before staging redeploy, the Netlify site ID or site name changes, OAuth would start, credentials are required, a social account connection is requested, posting, scheduling, analytics, DMs/comments, n8n activation, paid tools, domain/DNS, custom domain, production deploy, customer data, production data, Lead Gen, AI Receptionist, Constitution, accepted lesson, or permanent memory scope appears, validation or boot check fails, target checks fail, or the action expands beyond this exact draft UI milestone.",
  "evidence": [
    {
      "type": "owner_instruction",
      "reference": "Current thread owner-approved task to make the Social Media Management System staging app clickable and usable in draft mode without live integrations.",
      "verified": true
    },
    {
      "type": "pr_link",
      "reference": "https://github.com/gurnoorbassi/ag-social-media-management-system/pull/7",
      "verified": true
    },
    {
      "type": "review_note",
      "reference": ".codex/critiques/critique-runtime-target-pr-review-social-media-interactive-draft-ui-v1-20260705.json",
      "verified": true
    },
    {
      "type": "other",
      "reference": "Netlify deploy 6a4a0caed37d0800a1f19a0d ready and HTTP 200.",
      "verified": true
    },
    {
      "type": "validation_output",
      "reference": "AG OS dashboard build/check, validation, boot check, runtime tests, and target repo local checks must pass before final report.",
      "verified": false
    }
  ],
  "approvalText": "Owner-approved task: make the Social Media Management System staging app clickable and usable in draft mode. Allowed GitHub actions: create branch ag-os/social-media-interactive-draft-ui-v1, update app/source files, open PR, review PR, quality score, merge if clean, redeploy Netlify staging, and record proof. Do not execute OAuth, post, schedule, connect accounts, call analytics APIs, activate n8n, use credentials, use paid tools, change domain/DNS, touch Lead Gen, touch AI Receptionist, or change Constitution.",
  "approvedAt": "2026-07-05T07:25:00Z",
  "expiresAt": "2026-07-06T07:25:00Z",
  "createdAt": "2026-07-05T07:25:00Z",
  "updatedAt": "2026-07-05T07:52:00Z"
}
