{
  "approvalId": "approval-20260704-social-media-netlify-staging",
  "status": "revoked",
  "ownerId": "owner-gurnoor-bassi",
  "requestedBy": "ag-os-runtime",
  "approvedBy": "REQUIRED_APPROVER_ID",
  "projectId": "project-social-media-management-system-v1",
  "commandCategory": "deploy_staging",
  "requestedAction": "Create or connect one dedicated Netlify staging-only site for gurnoorbassi/ag-social-media-management-system and deploy from main.",
  "target": "netlify:ag-social-media-management-system-staging",
  "scope": "This approval package, if converted into an active approved lock, allows AG OS to use Netlify for exactly one future staging-only deployment milestone for gurnoorbassi/ag-social-media-management-system. The allowed future actions are limited to creating or connecting one dedicated Netlify staging-only site named ag-social-media-management-system-staging, deploying from main at commit d3fcd8c6435433169686c2ec404a5f00c6cc62bd, verifying the staging URL returns HTTP 200, recording the Netlify deployment result, and stopping before production, custom domain, DNS, paid features, secrets, social account connection, social credentials, posting, scheduling, n8n activation, real client data, Lead Gen, AI Receptionist, or Constitution changes.",
  "riskLevel": "R4",
  "dataClass": "internal",
  "budget": {
    "required": false,
    "maxUsd": 0,
    "usageLedgerRef": ".codex/costs/budget.json"
  },
  "approvalRequiredFor": [
    "connect_netlify",
    "deploy_staging"
  ],
  "approvedActions": [
    "connect_netlify",
    "deploy_staging"
  ],
  "prohibitedActions": [
    "deploy_production",
    "create_production_deploy",
    "change_domain",
    "change_dns",
    "add_custom_domain",
    "connect_n8n",
    "activate_n8n",
    "connect_social_accounts",
    "use_social_credentials",
    "post_content",
    "schedule_content",
    "use_analytics_api",
    "use_paid_service",
    "use_credentials",
    "add_secrets",
    "add_tracking_scripts",
    "wire_forms_to_live_services",
    "access_real_client_data",
    "access_production_data",
    "access_customer_data",
    "change_lead_gen",
    "change_ai_receptionist",
    "change_constitution"
  ],
  "revocationPath": "This approval is revoked, expired, cancelled, or invalidated when the owner says stop or revoke, the expiration passes, the target repository changes, the target branch changes, the target main SHA changes without renewed approval, the Netlify site name changes, a custom domain or DNS change is needed, a paid Netlify feature is required, credentials or secrets would need to be stored in the repository, social credentials or account connections become necessary, posting or scheduling becomes necessary, n8n activation becomes necessary, validation or boot check fails, target repo checks fail, Netlify reports a configuration or billing blocker, an incident opens for this scope, any prohibited action becomes necessary, or the action expands beyond one dedicated staging-only Netlify deployment.",
  "evidence": [
    {
      "type": "owner_instruction",
      "reference": "Current thread owner instruction requested an approval package only for Netlify staging deployment of gurnoorbassi/ag-social-media-management-system.",
      "verified": true
    },
    {
      "type": "pr_link",
      "reference": "https://github.com/gurnoorbassi/ag-social-media-management-system/pull/1",
      "verified": true
    },
    {
      "type": "other",
      "reference": ".codex/netlify/netlify-plan-20260704-social-media-staging.json",
      "verified": false
    },
    {
      "type": "other",
      "reference": "docs/social-media-netlify-staging-approval-package.md",
      "verified": false
    },
    {
      "type": "validation_output",
      "reference": "npm.cmd run validate, npm.cmd run boot:check, and node --test tests/*.test.mjs must pass immediately before execution.",
      "verified": false
    }
  ],
  "approvalText": "REQUIRED_EXACT_OWNER_APPROVAL_TEXT",
  "approvedAt": "REQUIRED_APPROVED_AT",
  "expiresAt": "REQUIRED_EXPIRES_AT",
  "createdAt": "REQUIRED_CREATED_AT",
  "updatedAt": "REQUIRED_UPDATED_AT"
}
